{
    "id": "pool_of_tribute",
    "name": "The Pool of Tribute",
    "nameEn": "The Pool of Tribute",
    "expansion": "4.x 紅蓮之狂潮 (Stormblood)",
    "type": "trial",
    "playerCount": 8,
    "iLvlSync": null,
    "jobLevelSync": 64,
    "highEnd": false,
    "notes": "（此副本為自動生成骨架，歡迎透過 PR 補充機制提示！）",
    "bosses": []
}