{
    "id": "singularity_reactor",
    "name": "The Singularity Reactor",
    "nameEn": "The Singularity Reactor",
    "expansion": "3.x 蒼穹之禁城 (Heavensward)",
    "type": "trial",
    "playerCount": 8,
    "iLvlSync": null,
    "jobLevelSync": 60,
    "highEnd": false,
    "notes": "（此副本為自動生成骨架，歡迎透過 PR 補充機制提示！）",
    "bosses": []
}