{
    "id": "hells_kier",
    "name": "Hells\u0027 Kier",
    "nameEn": "Hells\u0027 Kier",
    "expansion": "4.x 紅蓮之狂潮 (Stormblood)",
    "type": "trial",
    "playerCount": 8,
    "iLvlSync": null,
    "jobLevelSync": 70,
    "highEnd": false,
    "notes": "（此副本為自動生成骨架，歡迎透過 PR 補充機制提示！）",
    "bosses": []
}