{
    "id": "castrum_fluminis",
    "name": "月讀殲滅戰",
    "nameEn": "Castrum Fluminis",
    "expansion": "4.x 紅蓮之狂潮 (Stormblood)",
    "type": "trial",
    "playerCount": 8,
    "iLvlSync": null,
    "jobLevelSync": 70,
    "highEnd": false,
    "notes": "（此副本為自動生成骨架，歡迎透過 PR 補充機制提示！）",
    "bosses": []
}