{
    "id": "dragons_neck",
    "name": "艾瑪吉娜杯鬥技大會決賽",
    "nameEn": "The Dragon\u0027s Neck",
    "expansion": "2.x 重生之境 (A Realm Reborn)",
    "type": "trial",
    "playerCount": 8,
    "iLvlSync": null,
    "jobLevelSync": 50,
    "highEnd": false,
    "notes": "（此副本為自動生成骨架，歡迎透過 PR 補充機制提示！）",
    "bosses": []
}