{
    "id": "edens_promise_anamorphosis_savage",
    "name": "伊甸零式希望樂園 再生之章3",
    "nameEn": "Eden\u0027s Promise: Anamorphosis (Savage)",
    "expansion": "5.x 漆黑的反叛者 (Shadowbringers)",
    "type": "raid",
    "playerCount": 8,
    "iLvlSync": null,
    "jobLevelSync": 80,
    "highEnd": false,
    "notes": "（此副本為自動生成骨架，歡迎透過 PR 補充機制提示！）",
    "bosses": []
}