{
    "id": "whorleater_hard",
    "name": "利維亞桑殲滅戰",
    "nameEn": "The *Whorleater* (Hard)",
    "expansion": "2.x 重生之境 (A Realm Reborn)",
    "type": "trial",
    "playerCount": 8,
    "iLvlSync": null,
    "jobLevelSync": 50,
    "highEnd": false,
    "notes": "（此副本為自動生成骨架，歡迎透過 PR 補充機制提示！）",
    "bosses": []
}