{
    "id": "alphascape_v30",
    "name": "歐米茄時空狹縫 阿爾法幻境3",
    "nameEn": "Alphascape V3.0",
    "expansion": "4.x 紅蓮之狂潮 (Stormblood)",
    "type": "raid",
    "playerCount": 8,
    "iLvlSync": null,
    "jobLevelSync": 70,
    "highEnd": false,
    "notes": "（此副本為自動生成骨架，歡迎透過 PR 補充機制提示！）",
    "bosses": []
}