{
    "id": "edens_gate_sepulture",
    "name": "Eden\u0027s Gate: Sepulture",
    "nameEn": "Eden\u0027s Gate: Sepulture",
    "expansion": "5.x 漆黑的反叛者 (Shadowbringers)",
    "type": "raid",
    "playerCount": 8,
    "iLvlSync": null,
    "jobLevelSync": 80,
    "highEnd": false,
    "notes": "（此副本為自動生成骨架，歡迎透過 PR 補充機制提示！）",
    "bosses": []
}