{
    "id": "second_coil_of_bahamut_savage_-_turn_2",
    "name": "巴哈姆特零式大迷宮 入侵之章2",
    "nameEn": "The Second Coil of Bahamut (Savage) - Turn 2",
    "expansion": "2.x 重生之境 (A Realm Reborn)",
    "type": "raid",
    "playerCount": 8,
    "iLvlSync": null,
    "jobLevelSync": 50,
    "highEnd": false,
    "notes": "（此副本為自動生成骨架，歡迎透過 PR 補充機制提示！）",
    "bosses": []
}