{
    "id": "clyteum",
    "name": "軍工要地克呂提俄斯魔導工廠",
    "nameEn": "The Clyteum",
    "expansion": "7.x 黃金的遺產 (Dawntrail)",
    "type": "dungeon",
    "playerCount": 4,
    "iLvlSync": null,
    "jobLevelSync": 100,
    "highEnd": false,
    "notes": "（此副本為自動生成骨架，歡迎透過 PR 補充機制提示！）",
    "bosses": []
}