{
    "id": "interphos",
    "name": "The Interphos",
    "nameEn": "The Interphos",
    "expansion": "7.x 黃金的遺產 (Dawntrail)",
    "type": "trial",
    "playerCount": 8,
    "iLvlSync": 700,
    "jobLevelSync": 100,
    "highEnd": false,
    "notes": "（此副本為自動生成骨架，歡迎透過 PR 補充機制提示！）",
    "bosses": []
}