{
    "id": "shisui_of_the_violet_tides",
    "name": "海底宮殿紫水宮",
    "nameEn": "Shisui of the Violet Tides",
    "expansion": "4.x 紅蓮之狂潮 (Stormblood)",
    "type": "dungeon",
    "playerCount": 4,
    "iLvlSync": null,
    "jobLevelSync": 64,
    "highEnd": false,
    "notes": "（此副本為自動生成骨架，歡迎透過 PR 補充機制提示！）",
    "bosses": []
}