{
    "id": "aac_cruiserweight_m1",
    "name": "阿卡狄亞登天鬥技場 中量級1",
    "nameEn": "AAC Cruiserweight M1",
    "expansion": "7.x 黃金的遺產 (Dawntrail)",
    "type": "raid",
    "playerCount": 8,
    "iLvlSync": null,
    "jobLevelSync": 100,
    "highEnd": false,
    "notes": "（此副本為自動生成骨架，歡迎透過 PR 補充機制提示！）",
    "bosses": []
}