{
    "id": "abyssos_the_eighth_circle",
    "name": "Abyssos: The Eighth Circle",
    "nameEn": "Abyssos: The Eighth Circle",
    "expansion": "6.x 曉月之終途 (Endwalker)",
    "type": "raid",
    "playerCount": 8,
    "iLvlSync": null,
    "jobLevelSync": 90,
    "highEnd": false,
    "notes": "（此副本為自動生成骨架，歡迎透過 PR 補充機制提示！）",
    "bosses": []
}