{
  "id": "sastasha_normal",
  "name": "薩斯塔夏溶洞",
  "nameEn": "Sastasha",
  "expansion": "2.0 新生艾歐傑亞",
  "type": "dungeon",
  "playerCount": 4,
  "iLvlSync": null,
  "notes": "新手第一個 4 人本，主要訓練基本走位與打斷小怪施法。",
  "bosses": [
    {
      "name": "黑鯊海盜團船長",
      "nameEn": "Captain Madison",
      "notes": "戰鬥中會召喚兩條鯊魚加入戰場。",
      "phases": [
        {
          "name": "戰鬥全程",
          "mechanics": [
            {
              "name": "選擇正確的閘門",
              "type": "other",
              "description": "戰鬥前需要先擊破 4 個珊瑚色閘門開關之一，但只有正確顏色才能開啟通道。",
              "tips": [
                "觀察房間內鯊魚雕像的顏色，與該色相同的開關就是正解",
                "若開錯閘門會召喚一條額外的鯊魚"
              ]
            },
            {
              "name": "Bloody Cleave",
              "type": "tankbuster",
              "description": "對當前仇恨第一目標施放的扇形範圍攻擊。",
              "tips": ["坦克注意減傷，奶媽留意 HP"]
            },
            {
              "name": "全體 AoE",
              "type": "raidwide",
              "description": "全圖無法閃避的傷害。",
              "tips": ["奶媽記得 AoE 加血"]
            }
          ]
        }
      ]
    }
  ]
}
