{
    "id": "sirensong_sea",
    "name": "漂流海域妖歌海",
    "nameEn": "The Sirensong Sea",
    "expansion": "4.x 紅蓮之狂潮 (Stormblood)",
    "type": "dungeon",
    "playerCount": 4,
    "iLvlSync": null,
    "jobLevelSync": 62,
    "highEnd": false,
    "notes": "（此副本為自動生成骨架，歡迎透過 PR 補充機制提示！）",
    "bosses": []
}